{
  "$schema": "https://json-schema.org/draft/2020-12/schema",
  "$id": "https://tenantscript.dev/schemas/template-submission-v1.json",
  "title": "TenantScript community template submission",
  "type": "object",
  "additionalProperties": false,
  "required": [
    "schemaVersion",
    "kind",
    "slug",
    "displayName",
    "summary",
    "license",
    "source",
    "sdk",
    "hook",
    "capabilities",
    "egress",
    "configKeys",
    "verification",
    "reviewRecord",
    "securityNote",
    "nonGuarantees"
  ],
  "properties": {
    "schemaVersion": { "const": 1 },
    "kind": { "enum": ["community", "simulation"] },
    "slug": { "type": "string", "pattern": "^[a-z0-9]+(?:-[a-z0-9]+)*$" },
    "displayName": { "type": "string", "minLength": 1, "maxLength": 80 },
    "summary": { "type": "string", "minLength": 1, "maxLength": 240 },
    "license": { "type": "string", "minLength": 1, "maxLength": 80 },
    "source": {
      "type": "object",
      "additionalProperties": false,
      "required": ["repository", "revision", "directory", "files"],
      "properties": {
        "repository": { "type": "string", "format": "uri" },
        "revision": { "type": "string", "pattern": "^[0-9a-f]{40}$" },
        "directory": { "type": "string", "minLength": 1 },
        "files": {
          "type": "object",
          "minProperties": 1,
          "additionalProperties": { "type": "string", "pattern": "^[0-9a-f]{64}$" }
        }
      }
    },
    "sdk": {
      "type": "object",
      "additionalProperties": false,
      "required": ["range", "lastTestedVersion"],
      "properties": {
        "range": { "type": "string", "pattern": "^\\^[0-9]+\\.[0-9]+\\.[0-9]+$" },
        "lastTestedVersion": {
          "type": "string",
          "pattern": "^(0|[1-9][0-9]*)\\.(0|[1-9][0-9]*)\\.(0|[1-9][0-9]*)$"
        }
      }
    },
    "hook": {
      "type": "object",
      "additionalProperties": false,
      "required": ["name", "type", "failurePolicy"],
      "properties": {
        "name": { "type": "string", "pattern": "^[a-z0-9]+(?:[.-][a-z0-9]+)*$" },
        "type": { "enum": ["event", "transform", "policy"] },
        "failurePolicy": { "enum": ["fail-closed", "use-original", "record-only"] }
      },
      "oneOf": [
        {
          "properties": {
            "type": { "const": "event" },
            "failurePolicy": { "const": "record-only" }
          }
        },
        {
          "properties": {
            "type": { "const": "transform" },
            "failurePolicy": { "enum": ["fail-closed", "use-original"] }
          }
        },
        {
          "properties": {
            "type": { "const": "policy" },
            "failurePolicy": { "const": "fail-closed" }
          }
        }
      ],
      "allOf": [
        {
          "if": {
            "required": ["name"],
            "properties": { "name": { "const": "webhook.outbound" } }
          },
          "then": {
            "properties": {
              "type": { "const": "transform" },
              "failurePolicy": { "const": "fail-closed" }
            }
          }
        }
      ]
    },
    "capabilities": {
      "type": "array",
      "uniqueItems": true,
      "items": { "type": "string", "pattern": "^[a-z0-9]+(?:[.-][a-z0-9]+)*$" }
    },
    "egress": {
      "type": "object",
      "additionalProperties": false,
      "required": ["mode", "allowHosts"],
      "properties": {
        "mode": { "const": "deny" },
        "allowHosts": {
          "type": "array",
          "maxItems": 0,
          "uniqueItems": true,
          "items": { "type": "string", "pattern": "^[a-z0-9](?:[a-z0-9.-]*[a-z0-9])?$" }
        }
      }
    },
    "configKeys": {
      "type": "array",
      "uniqueItems": true,
      "items": { "type": "string", "pattern": "^[A-Za-z][A-Za-z0-9]*$" }
    },
    "verification": {
      "type": "object",
      "additionalProperties": false,
      "required": ["commands", "evidence", "behaviorCases"],
      "properties": {
        "commands": {
          "type": "object",
          "additionalProperties": false,
          "required": ["build", "test", "audit"],
          "properties": {
            "build": { "const": "pnpm build" },
            "test": { "const": "pnpm test" },
            "audit": {
              "const": "ext audit --manifest ./manifest.json --package ./package.json --bundle ./dist/plugin.cjs"
            }
          }
        },
        "evidence": {
          "type": "array",
          "minItems": 1,
          "uniqueItems": true,
          "items": { "type": "string", "minLength": 1 }
        },
        "behaviorCases": {
          "type": "array",
          "minItems": 2,
          "maxItems": 16,
          "items": {
            "type": "object",
            "additionalProperties": false,
            "required": ["name", "payload", "expected", "capabilityCalls"],
            "properties": {
              "name": {
                "type": "string",
                "pattern": "^[a-z0-9]+(?:-[a-z0-9]+)*$"
              },
              "payload": true,
              "expected": {
                "oneOf": [
                  {
                    "type": "object",
                    "additionalProperties": false,
                    "required": ["ok", "value"],
                    "properties": { "ok": { "const": true }, "value": true }
                  },
                  {
                    "type": "object",
                    "additionalProperties": false,
                    "required": ["ok", "error"],
                    "properties": {
                      "ok": { "const": false },
                      "error": {
                        "type": "object",
                        "additionalProperties": false,
                        "required": ["code"],
                        "properties": {
                          "code": {
                            "enum": [
                              "input_invalid",
                              "snapshot_unavailable",
                              "snapshot_integrity_failed",
                              "plugin_artifact_invalid",
                              "plugin_timeout",
                              "plugin_memory_exceeded",
                              "plugin_subrequest_exceeded",
                              "plugin_result_invalid",
                              "capability_denied",
                              "capability_failed",
                              "egress_denied",
                              "destination_unavailable",
                              "evidence_unavailable",
                              "runtime_unavailable"
                            ]
                          }
                        }
                      }
                    }
                  }
                ]
              },
              "capabilityCalls": {
                "type": "array",
                "maxItems": 8,
                "items": {
                  "type": "object",
                  "additionalProperties": false,
                  "required": ["name", "input", "result"],
                  "properties": {
                    "name": {
                      "type": "string",
                      "pattern": "^[a-z0-9]+(?:[.-][a-z0-9]+)*$"
                    },
                    "input": true,
                    "result": true
                  }
                }
              }
            }
          }
        }
      }
    },
    "reviewRecord": { "type": "string", "minLength": 1 },
    "securityNote": { "type": "string", "minLength": 1 },
    "nonGuarantees": {
      "type": "array",
      "minItems": 1,
      "uniqueItems": true,
      "items": { "type": "string", "minLength": 1, "maxLength": 240 }
    }
  }
}
